job_id,job_position,company_name,clean_job_description,city,region,country,post_year,post_month,post_day
3764987310,machine learning developer,mindpal,We are looking for Machine Learning Developer Job Responsibilities Working on machine learning projects Analyzing and processing data to create machine learning models Implementing and optimizing machine learning algorithms Testing and evaluating models Collaborating with the programming team and other departments within the company to develop innovative solutions Requirements Minimum 2 years of experience in the field of machine learning Knowledge of machine learning algorithms and techniques Ability to analyze and process data Familiarity with machine learning tools and technologies Proficient in English communication Education in computer science We Offer B2B contract type Full-time employment Remote and flexible working hours,tallinn,harjumaa,estonia,2023,11,14
3830015186,machine learning engineer,stafide,"We are in search of a passionate Machine Learning Engineer with a keen interest in computer vision. In an Azure cloud environment, youll be instrumental in building Advanced Analytics solutions, developing predictive models from vast data sets using cutting-edge computer vision techniques for applications based on real-time data. Furthermore, youll ensure these models are production-ready and deploy them via Cl/CD methodologies. Your expertise and collaborative spirit will be key as you: Develop predictive models and applications using computer vision. Analyze models in production to continuously enhance their performance. Write production-grade code that leverages real-time data, adding value to operations. Craft tests and document the code and architecture thoroughly. Deploy code and architecture to production through Cl/CD pipelines. Engage with business partners proactively to understand customer needs. Maintain a critical eye on product quality and stability, offering and implementing improvements. Requirements A completed technical Masters degree, preferably in AI, (applied) mathematics, data science, or computer science. A minimum of 3 years of relevant work experience in data science/Al with a specialization in computer vision. Proficiency in developing production-ready software and conducting thorough testing. Skilled Python, Git, pyTorch/ TensorFlow, OpenCV, Infrastructure as Code (Terraform, ARM/Bicep), Docker, Azure DevOps, Cl/CD. Solid understanding of computer science fundamentals (testing, design patterns, object-oriented programming, etc.). Experience with setting up (data science) cloud architecture within Microsoft Azure is a plus: Machine Learning workspace, Function App, Keyvault, Container registry, Log Analytics, Networking, etc. Familiarity with Agile and DevOps methodologies and the courage to take responsibility for shared sprint outcomes. The ability to explore alternative paths to achieve goals and remain steadfast under pressure. Additional Candidate Preferences: Location: We have a strong preference for candidates who are currently based in the Netherlands or within Europe. This facilitates a smoother transition and integration into our team given our operational locations and work culture. Visa Sponsorship: For international candidates not currently in the Netherlands, we are open to sponsoring visas. However, this offer extends specifically to those who have a minimum of one years experience working with a Dutch client. This criterion helps ensure that potential candidates are already familiar with the Dutch work environment and regulatory landscape, easing the onboarding process. Availability: Ideal candidates will be available to start immediately or within a 30-day period. We value the ability to mobilize quickly and integrate efficiently into our dynamic work environment, contributing to our ongoing projects without delay.",utrecht,utrecht,netherlands,2024,2,14
3841341377,machine/deep learning  computer vision intern,station f,"About At Scortex, we love factories. The smell of grease, the sparks of welding, the jingling of conveyor belts. We appreciate the beauty of a well-crafted industrial process, delivering value at a massive scale in the physical world. That is why we are pained to see manufacturing companies struggle with their quality. Throwing away parts by the thousands, or missing the needle in the haystack, letting faulty products slip through their tired eyes, despite all their efforts. We decided to solve this major headache of theirs, by building the required technology and making it accessible to everyone. Leveraging Machine Learning, Our Platform Allows Customers To detect faulty parts on a production line, automatically, in real-time, know and understand quality issues at a large scale, dynamically improve the quality of the production. We believe that the digitalization of manufacturing operations will provide unprecedented returns in quality, efficiency, and environmental impact. Scortex is a team of passionate and diverse individuals, working and learning together to deliver the best solution possible. A fast-growing organization, and unique blend of the tech and manufacturing world. Obviously, we have a flexible hybrid/remote work policy. Job Description As a proactive member of the machine learning and computer vision team, you will face and surmount a variety of challenges. Specifically, you will: Explore various state-of-the-art techniques to help solve tasks currently unbeaten by computers Stay on the bleeding edge of research and participate actively in the community Design and implement machine learning models that achieve outstanding defect-detection performance while simultaneously being light-weight enough to run in real-time on our embedded system. Help improve our data acquisition, training and inference pipelines Because of the current time required by the French administration to process visas and internship applications, this position is open only for students that are (I) enrolled in universities that can provide a french internship agreement and (II) do not require a visa to enter France and begin an internship. In addition, we are currently looking for students able to do a long term internship of 5 to 6 months. Preferred Experience In-depth knowledge of deep learning techniques applied to computer vision: deep convolutional networks, vision transformers, vision-language models, knowledge distillation Proficient knowledge of both supervised and unsupervised machine learning techniques: clustering, object detection, generative models, dimensionality reduction, anomaly detection Understanding of standard computer vision techniques : filtering, transformations, descriptors and detectors Knowledge and understanding of the mathematics underlying all of the above: probability and statistics, optimization, linear algebra, numerical computation Proven experience with at least one machine learning framework, preferably Pytorch Good programming and software engineering skills Experience with the unix environment Because of the current time required by the French administration to process visas and internship applications, this position is open only for students that are (I) enrolled in universities that can provide a french internship agreement and (II) do not require a visa to enter France and begin an internship. In addition, we are currently looking for students able to do a long term internship of 5 to 6 months. Recruitment Process Questionnaire -&gt; Intro call -&gt; Technical interview / Founder interview Additional Information Contract Type: Internship (Between 5 and 6 months) Location: Paris Education Level: Master's Degree",paris,îledefrance,france,2024,3,1
3832847383,junior data scientist (m/w/d),turbit,"Turbit develops and researches AI services for renewable energy assets. It has established itself as a market leader in AI-based operational management of wind turbines in Europe. Tasks Work in our core team as a Junior Data Scientist. Improve your Data Science skills within a large software project. Learn new machine learning and software engineering techniques from your team. Support your colleagues on exciting wind energy projects. Write test-driven code. Work with one of the most interesting and largest datasets in wind energy. Learn more about the operation of wind turbines by gaining deep insights into their data. Have an impact on thousands of wind turbines in Europe. Requirements You have just finished your degree in Computer Science, Physics, Mathematics, or a related field and your master's degree is no older than 2 years. You show excellent knowledge in data science, machine learning, and statistics. You are very familiar with the Python data science stack (pandas, numpy, scikit learn, tensorflow, ...). You love analytical thinking and have shown in the past that you are very good at it. You are passionate about renewable energy. You are excellent in written and spoken English. You have an open personality and positive charisma. Benefits You'll be part of a start-up making a significant impact. Our mission is to increase the efficiency of the renewable energy industry through our expertise in Data Analytics, Software Engineering, and Data Science. Your personal development has a very high priority for us. Beautiful modern office in the heart of Berlin. Home office and ""work from anywhere in Germany"" culture. Lunch Benefits. Regular Team Events. Be creative and bring your ideas to life in an environment that cherishes innovation. We are a diverse team that believes in the power of diverse people, perspectives, and experiences. Interested? Get in touch. Send us your application letter with a full CV and references/grades. We are looking forward to meeting you!",berlin,berlin,germany,2024,2,17
3764982974,machine learning developer,mindpal,We are looking for Machine Learning Developer Job Responsibilities Working on machine learning projects Analyzing and processing data to create machine learning models Implementing and optimizing machine learning algorithms Testing and evaluating models Collaborating with the programming team and other departments within the company to develop innovative solutions Requirements Minimum 2 years of experience in the field of machine learning Knowledge of machine learning algorithms and techniques Ability to analyze and process data Familiarity with machine learning tools and technologies Proficient in English communication Education in computer science We Offer B2B contract type Full-time employment Remote and flexible working hours,düsseldorf,north rhinewestphalia,germany,2023,11,14
3837683576,junior ai developer stage,proxima group,"Proxima è un gruppo di aziende con skill funzionali e tecnologiche innovative, che mettono a fattor comune la propria esperienza in un’offerta congiunta di sviluppo di soluzioni all’interno della nostra Software Factory. Offriamo consulenza e servizi di Application Management e Quality Assurance. È in partenza il nuovo progetto di Smart Search basato sull'IA all'interno della nostra Software Factory aziendale. Siamo alla ricerca di giovani talenti da inserire all’interno di LAB+, il nostro laboratorio di training on the job. Chi cerchiamo? Siamo alla ricerca di neolaureat* in informatica o simili o diplomat* in discipline tecnico scientifiche che abbiano già preso parte ad un corso professionalizzante/Academy. Nel LAB+ le risorse verranno inserite in un percorso di training on the job volto a fornire una comprensione approfondita del processo di sviluppo, dell’ambiente architetturale e competenze come sviluppatore Back End con specializzazione in Java e Python. Dove e come? Roma, in presenza presso la sede Direzionale di Proxima Group (Via della Maglianella, 65R). LAB + prevede un inserimento in stage della durata di 6 mesi con formula 3 + 3. Alle risorse più meritevoli verrà proposto un inserimento in azienda. L'impegno stabilito è di 8 ore giornaliere/40 ore settimanali. Di cosa ti occuperai? Il LAB+ ti fornirà una base solida di conoscenze teoriche e competenze pratiche attraverso l’esperienza diretta nello sviluppo software: Acquisirai competenze in tema di IA e sviluppo software, oltre che competenze trasversali utili per il lavoro di developer/consulente; Parteciperai allo sviluppo del Motore tramite la scelta e l'implementazione di algoritmi, la raccolta e la pulizia dei dati, la creazione di modelli e la loro ottimizzazione; Collaborerai in un Team Multidisciplinare composto da ingegneri del software, data scientist, e specialisti in machine learning; Adopererai di prima mano strumenti tecnologici complessi e di ultima generazione. Hai queste competenze? Laurea in informatica o simili o diploma in discipline tecnico scientifiche + corso professionalizzante/Academy Hai una conoscenza base di un linguaggio di programmazione ad oggetti, preferibilmente Java o Python Conosci i principali sistemi operativi Conosci i Pattern Design architetturali Possiedi una conoscenza base di SQL/NOSQL Hai una conoscenza base Networking Hai un forte interesse nel settore dell’IA e del Machine Learning Sei il candidato ideale se… Possiedi ottime capacità relazionali e di team working, sei una persona fortemente motivata e proattiva Cosa offriamo? INSERIMENTO IN STAGE 3 MESI + 3 MESI RIMBORSO 800€/MESE BUONI PASTO I nostri benefit PERCORSI DI CARRIERA Abbiamo un articolato sistema di valutazione delle competenze e misurazione delle performance che consente al dipendente di crescere insieme a noi. FORMAZIONE PROFESSIONALIZZANTE Offriamo percorsi di formazione e di aggiornamento professionale con taglio tecnico/pratico su tematiche in ambito ICT. Ogni famiglia tecnologica ha uno o più ICT trainer di riferimento, che, lavorando in piena sinergia con l’area HR, valuta e propone percorsi di formazione continua customizzati sulla crescita professionale di ogni dipendente. SCONTI E PROMOZIONI RISERVATE Abbiamo stabilito degli accordi con delle piattaforme per riservare ai nostri dipendenti scontistica e promozioni esclusive. Il presente annuncio è rivolto a entrambi i sessi, ai sensi delle leggi 903/77 e 125/91, e a persone di tutte le età e tutte le nazionalità, ai sensi dei decreti legislativi 215/03 e 216/03.",rome,latium,italy,2024,2,22
3764989126,machine learning developer,mindpal,We are looking for Machine Learning Developer Job Responsibilities Working on machine learning projects Analyzing and processing data to create machine learning models Implementing and optimizing machine learning algorithms Testing and evaluating models Collaborating with the programming team and other departments within the company to develop innovative solutions Requirements Minimum 2 years of experience in the field of machine learning Knowledge of machine learning algorithms and techniques Ability to analyze and process data Familiarity with machine learning tools and technologies Proficient in English communication Education in computer science We Offer B2B contract type Full-time employment Remote and flexible working hours,charleroi,walloon region,belgium,2023,11,14
3821864836,machine learning developer,mindpal,We are looking for Machine Learning Developer Job Responsibilities Working on machine learning projects Analyzing and processing data to create machine learning models Implementing and optimizing machine learning algorithms Testing and evaluating models Collaborating with the programming team and other departments within the company to develop innovative solutions Requirements Minimum 2 years of experience in the field of machine learning Knowledge of machine learning algorithms and techniques Ability to analyze and process data Familiarity with machine learning tools and technologies Proficient in English communication Education in computer science We Offer B2B contract type Full-time employment Remote and flexible working hours,paris,îledefrance,france,2024,1,10
3764990010,machine learning developer,mindpal,We are looking for Machine Learning Developer Job Responsibilities Working on machine learning projects Analyzing and processing data to create machine learning models Implementing and optimizing machine learning algorithms Testing and evaluating models Collaborating with the programming team and other departments within the company to develop innovative solutions Requirements Minimum 2 years of experience in the field of machine learning Knowledge of machine learning algorithms and techniques Ability to analyze and process data Familiarity with machine learning tools and technologies Proficient in English communication Education in computer science We Offer B2B contract type Full-time employment Remote and flexible working hours,rotterdam,south holland,netherlands,2023,11,14
3709257563,machine learning engineer,in4ge,"Aktualnie do jednego z projektów, który realizujemy dla naszego Klienta, poszukujemy osoby na stanowisko Machine Learning Engineer. Rola: Machine Learning Engineer Lokalizacja: Warszawa Tryb: hybrydowy / zdalnie Czym Będziesz Się Zajmował/a Poszukujemy doświadczonego Inżyniera Machine Learning, który dołączy do naszego odpowiedzialnego za rozwijanie i wdrażanie rozwiązań opartych na uczeniu maszynowym. Osoba na tym stanowisku będzie uczestniczyć w projektowaniu, trenowaniu i optymalizacji modeli ML, w celu dostarczenia innowacyjnych produktów i usług. Nasze Wymagania Wykształcenie wyższe w dziedzinie informatyki, nauk ścisłych, matematyki lub pokrewnych. Doświadczenie w pracy z algorytmami uczenia maszynowego oraz głębokim uczeniem. Umiejętność programowania w językach takich jak Python, TensorFlow, PyTorch. Zrozumienie matematycznych i statystycznych podstaw uczenia maszynowego. Znajomość narzędzi do eksploracji danych i przetwarzania sygnałów. Doświadczenie w przetwarzaniu i analizie dużych zbiorów danych. Umiejętność przekształcania teorii ML na praktyczne rozwiązania. Znajomość języka angielskiego na poziomie min. B2. Znajomość języka polskiego na poziomie min. C1. Możemy Zaoferować Możliwość rozwoju w strukturach organizacji dla której będziesz realizować zdania. Wsparcie doświadczonych w swoich dziedzinach ekspertów. Przyjazną i szanującą kulturę pracy, opartą na wzajemnym zaufaniu, szacunku i uczciwości Współpracę w oparciu o umowę B2B i atrakcyjne wynagrodzenie.",warsaw,mazowieckie,poland,2023,8,31
3842923698,data scientist,digital skills ltd,"Data Scientist Remote / Amsterdam (Hybrid Working) 9-month contract €90 - €110 per hour – based on a 40-hour working week. Digital Skills is proud to partner with a leading global travel agency in their search for a dynamic Data Scientist. We are seeking an accomplished individual who can leverage data to deliver actionable insights, driving strategic decisions for the organization. Role Overview: As a member of our data science team, you will collaborate with stakeholders across the company to extract valuable insights from complex datasets. Your role will involve translating business challenges into data problems, employing statistical analysis and modelling techniques to provide practical solutions. A successful candidate will excel in data storytelling, effectively communicating findings to drive business actions. Key Responsibilities: · Analyse large datasets to derive actionable insights. · Translate business challenges into data problems and develop effective solutions. · Identify, source, and prepare data for analysis. · Proactively engage and manage stakeholders through effective communication. · Utilize data visualization techniques to communicate findings. · Design and interpret quantitative experiments to guide decision-making. · Thrive in a fast-paced environment, taking ownership of tasks and adapting quickly. · Collaborate with team members, challenging ideas and methods. · Ensure the quality and reproducibility of work through peer review. · Apply data mining techniques with statistical rigor. · Present complex analysis results convincingly to stakeholders. · Incorporate scalability and long-term orientation into data science projects. Key Skills: · Minimum 6 years of relevant experience as a Data Scientist. · Proficiency in data analysis, statistics, machine learning, programming, and experimentation. · Strong working knowledge of Hadoop, Spark, SQL, Python, and/or R, Git. · Ability to translate business problems into data problems effectively. · Expertise in data visualization and storytelling. · Solid understanding of statistics and experimentation. · Familiarity with data management concepts such as data pipelines and workflows. · Experience with various data analysis and modelling techniques. · Experience with attribution modelling is desirable. If you believe your skills and aspirations align with this role, we enthusiastically encourage you to apply without hesitation. If you feel that this opportunity suits your qualifications and interests, please don't hesitate to submit your application.",amsterdam area,amsterdam area,amsterdam area,2024,2,29
3764990012,machine learning developer,mindpal,We are looking for Machine Learning Developer Job Responsibilities Working on machine learning projects Analyzing and processing data to create machine learning models Implementing and optimizing machine learning algorithms Testing and evaluating models Collaborating with the programming team and other departments within the company to develop innovative solutions Requirements Minimum 2 years of experience in the field of machine learning Knowledge of machine learning algorithms and techniques Ability to analyze and process data Familiarity with machine learning tools and technologies Proficient in English communication Education in computer science We Offer B2B contract type Full-time employment Remote and flexible working hours,prague,prague,czechia,2023,11,14
3764988222,machine learning developer,mindpal,We are looking for Machine Learning Developer Job Responsibilities Working on machine learning projects Analyzing and processing data to create machine learning models Implementing and optimizing machine learning algorithms Testing and evaluating models Collaborating with the programming team and other departments within the company to develop innovative solutions Requirements Minimum 2 years of experience in the field of machine learning Knowledge of machine learning algorithms and techniques Ability to analyze and process data Familiarity with machine learning tools and technologies Proficient in English communication Education in computer science We Offer B2B contract type Full-time employment Remote and flexible working hours,budapest,budapest,hungary,2023,11,14
